<?xml version="1.0" encoding="utf-8" ?>
<HIVacSim xmlns:xsi="http://www.w3.org/2001/XMLSchema-instance" xmlns="urn:HIVacSim" xsi:schemaLocation="urn:HIVacSim HIVacSimData.xsd"
	Title="Simulation Models for the Control of the Dynamics of HIV Infection Through Vaccination"
	by="Israel Vieira" Version="1.1">
	<!--Scenario's simulation settings definition.-->
	<Scenario>
		<Description>Testing HIVacSim Data File</Description>
		<SimClock>Month</SimClock>
		<RunDuration>120</RunDuration>
		<NumberOfRuns>2</NumberOfRuns>
		<WarmUpType>Traditional</WarmUpType>
		<WarmUp>24</WarmUp>
		<WarmUpMaxConcurrent>2</WarmUpMaxConcurrent>
		<WarmUpPrConcurrent>1.0</WarmUpPrConcurrent>
		<WarmUpInfected>
			<Distribution>Fixed</Distribution>
			<ParamOne>1</ParamOne>
			<ParamTwo>0</ParamTwo>
			<ParamThree>0</ParamThree>
			<ParamFour>0</ParamFour>
		</WarmUpInfected>
		<Speed>100</Speed>
		<MaxDelay>2000</MaxDelay>
		<Animation>false</Animation>
		<AutoSeed>true</AutoSeed>
		<CustomSeed>19650218</CustomSeed>
		<PLNumerical>500</PLNumerical>
		<PLEstimate>300</PLEstimate>
		<PLAlgorithm>0.50</PLAlgorithm>
	</Scenario>
	<!--Define the disease of interest to be simulated-->
	<Disease>
		<Name>HIV/AIDS</Name>
		<Male2Female>0.003</Male2Female>
		<Female2Male>0.002</Female2Male>
		<Male2Male>0.01</Male2Male>
		<LifeInfection>true</LifeInfection>
		<STDDuration>
			<Distribution>Fixed</Distribution>
			<ParamOne>0</ParamOne>
			<ParamTwo>0</ParamTwo>
			<ParamThree>0</ParamThree>
			<ParamFour>0</ParamFour>
		</STDDuration>
		<AllowReinfection>false</AllowReinfection>
		<Mortality>0.98</Mortality>
		<LifeExpectancy>
			<Distribution>Uniform</Distribution>
			<ParamOne>84</ParamOne>
			<ParamTwo>144</ParamTwo>
			<ParamThree>0</ParamThree>
			<ParamFour>0</ParamFour>
		</LifeExpectancy>
	</Disease>
	<!--Population Core Groups Definition-->
	<Population Count="3">
		<Group Name="Under 25 years old">
			<Id>1</Id>
			<Topology>Free</Topology>
			<Alpha>1.0</Alpha>
			<Beta>1.0</Beta>
			<Radius>6371.0</Radius>
			<Distance>1.0</Distance>
			<Degrees>3</Degrees>
			<Size>60</Size>
			<Age>
				<Distribution>Weibull</Distribution>
				<ParamOne>15.791</ParamOne>
				<ParamTwo>2.181</ParamTwo>
				<ParamThree>24.114</ParamThree>
				<ParamFour>0</ParamFour>
			</Age>
			<LifeExpectancy>
				<Distribution>Uniform</Distribution>
				<ParamOne>876</ParamOne>
				<ParamTwo>924</ParamTwo>
				<ParamThree>0</ParamThree>
				<ParamFour>0</ParamFour>
			</LifeExpectancy>
			<STDPrevalence>0.2</STDPrevalence>
			<STDAge>
				<Distribution>Uniform</Distribution>
				<ParamOne>0</ParamOne>
				<ParamTwo>60</ParamTwo>
				<ParamThree>0</ParamThree>
				<ParamFour>0</ParamFour>
			</STDAge>
			<STDTest>0.13</STDTest>
			<Female>0.57</Female>
			<Male>0.43</Male>
			<Homosexual>0.05</Homosexual>
			<MaxConcurrent>2</MaxConcurrent>
			<PrConcurrent>0.50</PrConcurrent>
			<PrNewPartner>0.69</PrNewPartner>
			<PrCasual>0.05</PrCasual>
			<PrInternal>0.90</PrInternal>
			<StbDuration>
				<Distribution>LogNormal</Distribution>
				<ParamOne>8.236</ParamOne>
				<ParamTwo>97.688</ParamTwo>
				<ParamThree>195.70</ParamThree>
				<ParamFour>0</ParamFour>
			</StbDuration>
			<StbTransitory>
				<Distribution>LogNormal</Distribution>
				<ParamOne>-0.169</ParamOne>
				<ParamTwo>41.453</ParamTwo>
				<ParamThree>66.952</ParamThree>
				<ParamFour>0</ParamFour>
			</StbTransitory>
			<StbContacts>
				<Distribution>LogNormal</Distribution>
				<ParamOne>-0.055</ParamOne>
				<ParamTwo>6.814</ParamTwo>
				<ParamThree>6.309</ParamThree>
				<ParamFour>0</ParamFour>
			</StbContacts>
			<StbSafeSex>0.125</StbSafeSex>
			<CslDuration>
				<Distribution>Geometric</Distribution>
				<ParamOne>0.238</ParamOne>
				<ParamTwo>0</ParamTwo>
				<ParamThree>0</ParamThree>
				<ParamFour>0</ParamFour>
			</CslDuration>
			<CslContacts>
				<Distribution>LogNormal</Distribution>
				<ParamOne>-0.111</ParamOne>
				<ParamTwo>7.516</ParamTwo>
				<ParamThree>7.121</ParamThree>
				<ParamFour>0</ParamFour>
			</CslContacts>
			<CslSafeSex>0.147</CslSafeSex>
		</Group>
		<Group Name="Married Couples">
			<Id>2</Id>
			<Topology>Circle</Topology>
			<Alpha>1.0</Alpha>
			<Beta>1.0</Beta>
			<Radius>6371.0</Radius>
			<Distance>1.0</Distance>
			<Degrees>3</Degrees>
			<Size>55</Size>
			<Age>
				<Distribution>Weibull</Distribution>
				<ParamOne>15.791</ParamOne>
				<ParamTwo>2.181</ParamTwo>
				<ParamThree>24.114</ParamThree>
				<ParamFour>0</ParamFour>
			</Age>
			<LifeExpectancy>
				<Distribution>Uniform</Distribution>
				<ParamOne>876</ParamOne>
				<ParamTwo>924</ParamTwo>
				<ParamThree>0</ParamThree>
				<ParamFour>0</ParamFour>
			</LifeExpectancy>
			<STDPrevalence>0.2</STDPrevalence>
			<STDAge>
				<Distribution>Uniform</Distribution>
				<ParamOne>0</ParamOne>
				<ParamTwo>60</ParamTwo>
				<ParamThree>0</ParamThree>
				<ParamFour>0</ParamFour>
			</STDAge>
			<STDTest>0.13</STDTest>
			<Female>0.57</Female>
			<Male>0.43</Male>
			<Homosexual>0.05</Homosexual>
			<MaxConcurrent>2</MaxConcurrent>
			<PrConcurrent>0.50</PrConcurrent>
			<PrNewPartner>1</PrNewPartner>
			<PrCasual>0.02</PrCasual>
			<PrInternal>0.90</PrInternal>
			<StbDuration>
				<Distribution>LogNormal</Distribution>
				<ParamOne>8.236</ParamOne>
				<ParamTwo>97.688</ParamTwo>
				<ParamThree>195.70</ParamThree>
				<ParamFour>0</ParamFour>
			</StbDuration>
			<StbTransitory>
				<Distribution>LogNormal</Distribution>
				<ParamOne>-0.169</ParamOne>
				<ParamTwo>41.453</ParamTwo>
				<ParamThree>66.952</ParamThree>
				<ParamFour>0</ParamFour>
			</StbTransitory>
			<StbContacts>
				<Distribution>LogNormal</Distribution>
				<ParamOne>-0.055</ParamOne>
				<ParamTwo>6.814</ParamTwo>
				<ParamThree>6.309</ParamThree>
				<ParamFour>0</ParamFour>
			</StbContacts>
			<StbSafeSex>0.125</StbSafeSex>
			<CslDuration>
				<Distribution>Geometric</Distribution>
				<ParamOne>0.238</ParamOne>
				<ParamTwo>0</ParamTwo>
				<ParamThree>0</ParamThree>
				<ParamFour>0</ParamFour>
			</CslDuration>
			<CslContacts>
				<Distribution>LogNormal</Distribution>
				<ParamOne>-0.111</ParamOne>
				<ParamTwo>7.516</ParamTwo>
				<ParamThree>7.121</ParamThree>
				<ParamFour>0</ParamFour>
			</CslContacts>
			<CslSafeSex>0.147</CslSafeSex>
		</Group>
		<Group Name="Others">
			<Id>3</Id>
			<Topology>Sphere</Topology>
			<Alpha>1.0</Alpha>
			<Beta>1.0</Beta>
			<Radius>6371.0</Radius>
			<Distance>1.0</Distance>
			<Degrees>3</Degrees>
			<Size>50</Size>
			<Age>
				<Distribution>Weibull</Distribution>
				<ParamOne>15.791</ParamOne>
				<ParamTwo>2.181</ParamTwo>
				<ParamThree>24.114</ParamThree>
				<ParamFour>0</ParamFour>
			</Age>
			<LifeExpectancy>
				<Distribution>Uniform</Distribution>
				<ParamOne>876</ParamOne>
				<ParamTwo>924</ParamTwo>
				<ParamThree>0</ParamThree>
				<ParamFour>0</ParamFour>
			</LifeExpectancy>
			<STDPrevalence>0.2</STDPrevalence>
			<STDAge>
				<Distribution>Uniform</Distribution>
				<ParamOne>0</ParamOne>
				<ParamTwo>60</ParamTwo>
				<ParamThree>0</ParamThree>
				<ParamFour>0</ParamFour>
			</STDAge>
			<STDTest>0.13</STDTest>
			<Female>0.57</Female>
			<Male>0.43</Male>
			<Homosexual>0.1</Homosexual>
			<MaxConcurrent>2</MaxConcurrent>
			<PrConcurrent>0.50</PrConcurrent>
			<PrNewPartner>0.70</PrNewPartner>
			<PrCasual>0.02</PrCasual>
			<PrInternal>0.90</PrInternal>
			<StbDuration>
				<Distribution>LogNormal</Distribution>
				<ParamOne>8.236</ParamOne>
				<ParamTwo>97.688</ParamTwo>
				<ParamThree>195.70</ParamThree>
				<ParamFour>0</ParamFour>
			</StbDuration>
			<StbTransitory>
				<Distribution>LogNormal</Distribution>
				<ParamOne>-0.169</ParamOne>
				<ParamTwo>41.453</ParamTwo>
				<ParamThree>66.952</ParamThree>
				<ParamFour>0</ParamFour>
			</StbTransitory>
			<StbContacts>
				<Distribution>LogNormal</Distribution>
				<ParamOne>-0.055</ParamOne>
				<ParamTwo>6.814</ParamTwo>
				<ParamThree>6.309</ParamThree>
				<ParamFour>0</ParamFour>
			</StbContacts>
			<StbSafeSex>0.125</StbSafeSex>
			<CslDuration>
				<Distribution>Geometric</Distribution>
				<ParamOne>0.238</ParamOne>
				<ParamTwo>0</ParamTwo>
				<ParamThree>0</ParamThree>
				<ParamFour>0</ParamFour>
			</CslDuration>
			<CslContacts>
				<Distribution>LogNormal</Distribution>
				<ParamOne>-0.111</ParamOne>
				<ParamTwo>7.516</ParamTwo>
				<ParamThree>7.121</ParamThree>
				<ParamFour>0</ParamFour>
			</CslContacts>
			<CslSafeSex>0.147</CslSafeSex>
		</Group>
	</Population>
	<!--Population interaction matrix, digraph adjacency matrix-->
	<AdjMatrix Rows="3" Columns="3">
		<Cell Row="0" Column="0" Data="0.0" />
		<Cell Row="0" Column="1" Data="0.5" />
		<Cell Row="0" Column="2" Data="0.5" />
		<Cell Row="1" Column="0" Data="0.5" />
		<Cell Row="1" Column="1" Data="0.0" />
		<Cell Row="1" Column="2" Data="0.5" />
		<Cell Row="2" Column="0" Data="0.5" />
		<Cell Row="2" Column="1" Data="0.5" />
		<Cell Row="2" Column="2" Data="0.0" />
	</AdjMatrix>
	<!-- Preventive vaccine interventions-->
	<Vaccines Count="1">
		<Vaccine Name="ALVAC">
			<Id>1</Id>
			<Effectiveness>0.50</Effectiveness>
			<Lifetime>false</Lifetime>
			<Length>48</Length>
			<UsedBy>1</UsedBy>
		</Vaccine>
	</Vaccines>
	<!-- Intervention strategies-->
	<Interventions Count="1">
		<Strategy Name="Everyone safe">
			<Id>1</Id>
			<Active>false</Active>
			<Strategy>AllGroups</Strategy>
			<Groups></Groups>
			<Clock>1</Clock>
			<Population>0.6</Population>
			<Vaccine>1</Vaccine>
			<HIVTested>false</HIVTested>
			<HIVResult>NotImportant</HIVResult>
		</Strategy>
	</Interventions>
</HIVacSim>