<?xml version="1.0" encoding="utf-8"?>
<HIVacSim xmlns:xsi="http://www.w3.org/2001/XMLSchema-instance"
          xmlns="urn:HIVacSim" xsi:schemaLocation="urn:HIVacSim HIVacSimData.xsd" 
          Title="Simulation Models for the Control of the Dynamics of HIV Infection Through Vaccination" 
          by="Israel Vieira" 
          Version="1.7">
  <!--Scenario's simulation settings definition.-->
  <Scenario>
    <Description>Brazilian Population Sexual Behaviour and Perceptions of HIV/AIDS Survey, July 1999</Description>
    <SimClock>Month</SimClock>
    <RunDuration>144</RunDuration>
    <NumberOfRuns>10</NumberOfRuns>
    <WarmUpType>Traditional</WarmUpType>
    <WarmUp>24</WarmUp>
    <WarmUpMaxConcurrent>2</WarmUpMaxConcurrent>
    <WarmUpPrConcurrent>0.5</WarmUpPrConcurrent>
    <WarmUpInfected>
      <Distribution>Average</Distribution>
      <ParamOne>1</ParamOne>
      <ParamTwo>0</ParamTwo>
      <ParamThree>0</ParamThree>
      <ParamFour>0</ParamFour>
    </WarmUpInfected>
    <Speed>100</Speed>
    <MaxDelay>2000</MaxDelay>
    <Animation>false</Animation>
    <AutoSeed>true</AutoSeed>
    <CustomSeed>19650218</CustomSeed>
    <PLNumerical>500</PLNumerical>
    <PLEstimate>400</PLEstimate>
    <PLAlgorithm>0.13</PLAlgorithm>
  </Scenario>
  <!--Define the disease of interest to be simulated-->
  <Disease>
    <Name>HIV/AIDS</Name>
    <Male2Female>0.003</Male2Female>
    <Female2Male>0.002</Female2Male>
    <Male2Male>0.01</Male2Male>
    <LifeInfection>true</LifeInfection>
    <STDDuration>
      <Distribution>Average</Distribution>
      <ParamOne>0</ParamOne>
      <ParamTwo>0</ParamTwo>
      <ParamThree>0</ParamThree>
      <ParamFour>0</ParamFour>
    </STDDuration>
    <AllowReinfection>false</AllowReinfection>
    <Mortality>0.95</Mortality>
    <LifeExpectancy>
      <Distribution>Weibull</Distribution>
      <ParamOne>0</ParamOne>
      <ParamTwo>126.12</ParamTwo>
      <ParamThree>2.38</ParamThree>
      <ParamFour>0</ParamFour>
    </LifeExpectancy>
  </Disease>
  <!--Population Core Groups Definition-->
  <Population Count="1">
    <Group Name="Brazil">
      <Id>1</Id>
      <Topology>Sphere</Topology>
      <Alpha>0.226066111496547</Alpha>
      <Beta>1</Beta>
      <Radius>6378</Radius>
      <Distance>1568.42532234911</Distance>
      <Degrees>3</Degrees>
      <Size>3324</Size>
      <Age>
        <Distribution>Weibull</Distribution>
        <ParamOne>181.47</ParamOne>
        <ParamTwo>267.95</ParamTwo>
        <ParamThree>1.46</ParamThree>
        <ParamFour>0</ParamFour>
      </Age>
      <LifeExpectancy>
        <Distribution>Average</Distribution>
        <ParamOne>840</ParamOne>
        <ParamTwo>0</ParamTwo>
        <ParamThree>0</ParamThree>
        <ParamFour>0</ParamFour>
      </LifeExpectancy>
      <STDPrevalence>0.007</STDPrevalence>
      <STDAge>
        <Distribution>Weibull</Distribution>
        <ParamOne>0.13</ParamOne>
        <ParamTwo>47.78</ParamTwo>
        <ParamThree>1.36</ParamThree>
        <ParamFour>0</ParamFour>
      </STDAge>
      <STDTest>0.28</STDTest>
      <Female>0.55</Female>
      <Male>0.45</Male>
      <Homosexual>0.05</Homosexual>
      <MaxConcurrent>5</MaxConcurrent>
      <PrConcurrent>0.11</PrConcurrent>
      <PrNewPartner>0.82</PrNewPartner>
      <PrCasual>0.18</PrCasual>
      <PrInternal>1</PrInternal>
      <StbDuration>
        <Distribution>Weibull</Distribution>
        <ParamOne>0</ParamOne>
        <ParamTwo>141.36</ParamTwo>
        <ParamThree>1.1</ParamThree>
        <ParamFour>0</ParamFour>
      </StbDuration>
      <StbTransitory>
        <Distribution>Gamma</Distribution>
        <ParamOne>0</ParamOne>
        <ParamTwo>20.2</ParamTwo>
        <ParamThree>1.06</ParamThree>
        <ParamFour>0</ParamFour>
      </StbTransitory>
      <StbContacts>
        <Distribution>Gamma</Distribution>
        <ParamOne>0</ParamOne>
        <ParamTwo>4.83</ParamTwo>
        <ParamThree>1.41</ParamThree>
        <ParamFour>0</ParamFour>
      </StbContacts>
      <StbSafeSex>0.18</StbSafeSex>
      <CslDuration>
        <Distribution>InvNormal</Distribution>
        <ParamOne>-2.44</ParamOne>
        <ParamTwo>14.49</ParamTwo>
        <ParamThree>49.6</ParamThree>
        <ParamFour>0</ParamFour>
      </CslDuration>
      <CslContacts>
        <Distribution>Gamma</Distribution>
        <ParamOne>0</ParamOne>
        <ParamTwo>5.02</ParamTwo>
        <ParamThree>1.5</ParamThree>
        <ParamFour>0</ParamFour>
      </CslContacts>
      <CslSafeSex>0.42</CslSafeSex>
    </Group>
  </Population>
  <!--Population interaction, digraph adjacency matrix-->
  <AdjMatrix Rows="1" Columns="1">
    <Cell Row="0" Column="0" Data="0" />
  </AdjMatrix>
  <!--Preventive vaccine interventions-->
  <Vaccines Count="3">
    <Vaccine Name="Vaccine 25%">
      <Id>1</Id>
      <Effectiveness>0.25</Effectiveness>
      <Lifetime>true</Lifetime>
      <Length>0</Length>
      <UsedBy>1,4,7,10</UsedBy>
    </Vaccine>
    <Vaccine Name="Vaccine 50%">
      <Id>2</Id>
      <Effectiveness>0.5</Effectiveness>
      <Lifetime>true</Lifetime>
      <Length>0</Length>
      <UsedBy>2,5,8,11</UsedBy>
    </Vaccine>
    <Vaccine Name="Vaccine 75%">
      <Id>3</Id>
      <Effectiveness>0.75</Effectiveness>
      <Lifetime>true</Lifetime>
      <Length>0</Length>
      <UsedBy>3,6,9,12</UsedBy>
    </Vaccine>
  </Vaccines>
  <!--Intervention strategies-->
  <Interventions Count="12">
    <Strategy Name="Coverage 25% - Vaccine 25%">
      <Id>1</Id>
      <Active>false</Active>
      <Strategy>AllGroups</Strategy>
      <Groups />
      <Clock>1</Clock>
      <Population>0.25</Population>
      <Vaccine>1</Vaccine>
      <HIVTested>false</HIVTested>
      <HIVResult>HIVNegative</HIVResult>
    </Strategy>
    <Strategy Name="Coverage 25% - Vaccine 50%">
      <Id>2</Id>
      <Active>false</Active>
      <Strategy>AllGroups</Strategy>
      <Groups />
      <Clock>1</Clock>
      <Population>0.25</Population>
      <Vaccine>2</Vaccine>
      <HIVTested>false</HIVTested>
      <HIVResult>HIVNegative</HIVResult>
    </Strategy>
    <Strategy Name="Coverage 25% - Vaccine 75%">
      <Id>3</Id>
      <Active>false</Active>
      <Strategy>AllGroups</Strategy>
      <Groups />
      <Clock>1</Clock>
      <Population>0.25</Population>
      <Vaccine>3</Vaccine>
      <HIVTested>false</HIVTested>
      <HIVResult>HIVNegative</HIVResult>
    </Strategy>
    <Strategy Name="Coverage 50% - Vaccine 25%">
      <Id>4</Id>
      <Active>false</Active>
      <Strategy>AllGroups</Strategy>
      <Groups />
      <Clock>1</Clock>
      <Population>0.5</Population>
      <Vaccine>1</Vaccine>
      <HIVTested>false</HIVTested>
      <HIVResult>HIVNegative</HIVResult>
    </Strategy>
    <Strategy Name="Coverage 50% - Vaccine 50%">
      <Id>5</Id>
      <Active>false</Active>
      <Strategy>AllGroups</Strategy>
      <Groups />
      <Clock>1</Clock>
      <Population>0.5</Population>
      <Vaccine>2</Vaccine>
      <HIVTested>false</HIVTested>
      <HIVResult>HIVNegative</HIVResult>
    </Strategy>
    <Strategy Name="Coverage 50% - Vaccine 75%">
      <Id>6</Id>
      <Active>false</Active>
      <Strategy>AllGroups</Strategy>
      <Groups />
      <Clock>1</Clock>
      <Population>0.5</Population>
      <Vaccine>3</Vaccine>
      <HIVTested>false</HIVTested>
      <HIVResult>HIVNegative</HIVResult>
    </Strategy>
    <Strategy Name="Coverage 75% - Vaccine 25%">
      <Id>7</Id>
      <Active>false</Active>
      <Strategy>AllGroups</Strategy>
      <Groups />
      <Clock>1</Clock>
      <Population>0.75</Population>
      <Vaccine>1</Vaccine>
      <HIVTested>false</HIVTested>
      <HIVResult>HIVNegative</HIVResult>
    </Strategy>
    <Strategy Name="Coverage 75% - Vaccine 50%">
      <Id>8</Id>
      <Active>false</Active>
      <Strategy>AllGroups</Strategy>
      <Groups />
      <Clock>1</Clock>
      <Population>0.75</Population>
      <Vaccine>2</Vaccine>
      <HIVTested>false</HIVTested>
      <HIVResult>HIVNegative</HIVResult>
    </Strategy>
    <Strategy Name="Coverage 75% - Vaccine 75%">
      <Id>9</Id>
      <Active>false</Active>
      <Strategy>AllGroups</Strategy>
      <Groups />
      <Clock>1</Clock>
      <Population>0.75</Population>
      <Vaccine>3</Vaccine>
      <HIVTested>false</HIVTested>
      <HIVResult>HIVNegative</HIVResult>
    </Strategy>
    <Strategy Name="Coverage 100% - Vaccine 25%">
      <Id>10</Id>
      <Active>false</Active>
      <Strategy>AllGroups</Strategy>
      <Groups />
      <Clock>1</Clock>
      <Population>1</Population>
      <Vaccine>1</Vaccine>
      <HIVTested>false</HIVTested>
      <HIVResult>HIVNegative</HIVResult>
    </Strategy>
    <Strategy Name="Coverage 100% - Vaccine 50%">
      <Id>11</Id>
      <Active>false</Active>
      <Strategy>AllGroups</Strategy>
      <Groups />
      <Clock>1</Clock>
      <Population>1</Population>
      <Vaccine>2</Vaccine>
      <HIVTested>false</HIVTested>
      <HIVResult>HIVNegative</HIVResult>
    </Strategy>
    <Strategy Name="Coverage 100% - Vaccine 75%">
      <Id>12</Id>
      <Active>false</Active>
      <Strategy>AllGroups</Strategy>
      <Groups />
      <Clock>1</Clock>
      <Population>1</Population>
      <Vaccine>3</Vaccine>
      <HIVTested>false</HIVTested>
      <HIVResult>HIVNegative</HIVResult>
    </Strategy>
  </Interventions>
</HIVacSim>